{
  "$schema": "https://json-schema.org/draft/2020-12/schema",
  "$id": "https://example.invalid/game-library-bridge/games.schema.json",
  "title": "game-library-bridge snapshot",
  "type": "object",
  "additionalProperties": false,
  "required": [
    "schema_version",
    "snapshot_version",
    "generated_at",
    "identity",
    "sources",
    "owned",
    "waitlisted",
    "warnings"
  ],
  "properties": {
    "schema_version": {
      "type": "string",
      "pattern": "^\\d+\\.\\d+\\.\\d+$"
    },
    "snapshot_version": {
      "type": "integer",
      "minimum": 1
    },
    "generated_at": {
      "$ref": "#/$defs/utcTimestamp"
    },
    "content_hash": {
      "$comment": "Always emitted since schema 1.1.0; optional so 1.0.0 snapshots still validate. sha256 over canonical {identity, owned, waitlisted} — changes iff the library content changes.",
      "type": "string",
      "pattern": "^sha256:[0-9a-f]{64}$"
    },
    "owned_count": {
      "$comment": "Always emitted since schema 1.1.0. Equals owned.length.",
      "type": "integer",
      "minimum": 0
    },
    "waitlisted_count": {
      "$comment": "Always emitted since schema 1.1.0. Equals waitlisted.length.",
      "type": "integer",
      "minimum": 0
    },
    "identity": {
      "type": "object",
      "additionalProperties": false,
      "required": ["steam_id", "itad_user"],
      "properties": {
        "steam_id": { "type": "string", "pattern": "^\\d{17}$" },
        "itad_user": { "type": "string", "minLength": 1 }
      }
    },
    "sources": {
      "type": "object",
      "additionalProperties": false,
      "required": ["steam", "itad_collection", "itad_waitlist"],
      "properties": {
        "steam": { "$ref": "#/$defs/sourceProvenance" },
        "itad_collection": { "$ref": "#/$defs/sourceProvenance" },
        "itad_waitlist": { "$ref": "#/$defs/sourceProvenance" }
      }
    },
    "owned": {
      "type": "array",
      "items": { "$ref": "#/$defs/ownedGame" }
    },
    "waitlisted": {
      "type": "array",
      "items": { "$ref": "#/$defs/waitlistedGame" }
    },
    "warnings": {
      "type": "array",
      "items": { "type": "string" }
    }
  },
  "$defs": {
    "utcTimestamp": {
      "type": "string",
      "pattern": "^\\d{4}-\\d{2}-\\d{2}T\\d{2}:\\d{2}:\\d{2}Z$"
    },
    "sourceProvenance": {
      "type": "object",
      "additionalProperties": false,
      "required": ["status", "fetched_at", "count", "via", "error"],
      "properties": {
        "status": { "enum": ["ok", "error", "skipped"] },
        "fetched_at": {
          "oneOf": [{ "$ref": "#/$defs/utcTimestamp" }, { "type": "null" }]
        },
        "count": { "type": ["integer", "null"], "minimum": 0 },
        "via": { "type": ["string", "null"] },
        "error": { "type": ["string", "null"] }
      }
    },
    "ownedGame": {
      "type": "object",
      "additionalProperties": false,
      "required": [
        "title",
        "normalized_title",
        "steam_appid",
        "itad_id",
        "itad_slug",
        "playtime_minutes",
        "added_at",
        "sources"
      ],
      "properties": {
        "title": { "type": "string", "minLength": 1 },
        "normalized_title": { "type": "string" },
        "steam_appid": { "type": ["integer", "null"], "minimum": 0 },
        "itad_id": { "type": ["string", "null"], "minLength": 1 },
        "itad_slug": { "type": ["string", "null"] },
        "playtime_minutes": { "type": ["integer", "null"], "minimum": 0 },
        "added_at": {
          "oneOf": [{ "$ref": "#/$defs/utcTimestamp" }, { "type": "null" }]
        },
        "sources": {
          "type": "array",
          "minItems": 1,
          "uniqueItems": true,
          "items": { "enum": ["steam", "itad_collection"] }
        }
      }
    },
    "waitlistedGame": {
      "type": "object",
      "additionalProperties": false,
      "required": [
        "title",
        "normalized_title",
        "itad_id",
        "itad_slug",
        "added_at",
        "sources"
      ],
      "properties": {
        "title": { "type": "string", "minLength": 1 },
        "normalized_title": { "type": "string" },
        "itad_id": { "type": ["string", "null"], "minLength": 1 },
        "itad_slug": { "type": ["string", "null"] },
        "added_at": {
          "oneOf": [{ "$ref": "#/$defs/utcTimestamp" }, { "type": "null" }]
        },
        "sources": {
          "type": "array",
          "minItems": 1,
          "uniqueItems": true,
          "items": { "enum": ["itad_waitlist"] }
        }
      }
    }
  }
}
