{
  "schema_version": "1.1.0",
  "snapshot_version": 21,
  "generated_at": "2026-09-12T09:19:11Z",
  "content_hash": "sha256:d5437a191afa7080b20fb1db26895dc3790f3edb96aa2752a8d8c363195f1483",
  "identity": {
    "steam_id": "76561197970928054",
    "itad_user": "arcca"
  },
  "sources": {
    "steam": {
      "status": "ok",
      "fetched_at": "2026-09-12T09:19:09Z",
      "count": 122,
      "via": "steam-web-api",
      "error": null
    },
    "itad_collection": {
      "status": "ok",
      "fetched_at": "2026-09-12T09:19:11Z",
      "count": 115,
      "via": "json-api",
      "error": null
    },
    "itad_waitlist": {
      "status": "ok",
      "fetched_at": "2026-09-12T09:19:11Z",
      "count": 9,
      "via": "json-api",
      "error": null
    }
  },
  "owned_count": 129,
  "waitlisted_count": 9,
  "owned": [
    {
      "title": "3DMark Demo",
      "normalized_title": "3dmark demo",
      "steam_appid": 231350,
      "itad_id": null,
      "itad_slug": null,
      "playtime_minutes": 15,
      "added_at": null,
      "sources": [
        "steam"
      ]
    },
    {
      "title": "Against the Storm",
      "normalized_title": "against the storm",
      "steam_appid": 1336490,
      "itad_id": "018d937f-42c6-70a5-a29b-9d8c2e0f7b84",
      "itad_slug": "against-the-storm",
      "playtime_minutes": 0,
      "added_at": "2026-07-14T23:46:48Z",
      "sources": [
        "steam",
        "itad_collection"
      ]
    },
    {
      "title": "Aperture Desk Job",
      "normalized_title": "aperture desk job",
      "steam_appid": 1902490,
      "itad_id": null,
      "itad_slug": null,
      "playtime_minutes": 76,
      "added_at": null,
      "sources": [
        "steam"
      ]
    },
    {
      "title": "Assassin's Creed III Remastered",
      "normalized_title": "assassin s creed iii remastered",
      "steam_appid": 911400,
      "itad_id": "018d937f-2767-73fb-8a5f-3c25c3fd6789",
      "itad_slug": "assassins-creed-iii-remastered",
      "playtime_minutes": 0,
      "added_at": "2026-07-14T23:46:48Z",
      "sources": [
        "steam",
        "itad_collection"
      ]
    },
    {
      "title": "Assassin's Creed Odyssey",
      "normalized_title": "assassin s creed odyssey",
      "steam_appid": 812140,
      "itad_id": "018d937f-0184-7248-8d64-3c723c523111",
      "itad_slug": "assassins-creed-odyssey",
      "playtime_minutes": 0,
      "added_at": "2026-07-14T23:46:48Z",
      "sources": [
        "steam",
        "itad_collection"
      ]
    },
    {
      "title": "Assassin's Creed Valhalla",
      "normalized_title": "assassin s creed valhalla",
      "steam_appid": 2208920,
      "itad_id": "018d937f-4227-700c-9dbe-1190755ac02c",
      "itad_slug": "assassins-creed-valhalla",
      "playtime_minutes": 0,
      "added_at": "2026-07-14T23:46:48Z",
      "sources": [
        "steam",
        "itad_collection"
      ]
    },
    {
      "title": "Avowed",
      "normalized_title": "avowed",
      "steam_appid": 2457220,
      "itad_id": "018d937f-6ee2-70f6-940c-6212b045c9c3",
      "itad_slug": "avowed",
      "playtime_minutes": 7,
      "added_at": "2026-07-14T23:46:48Z",
      "sources": [
        "steam",
        "itad_collection"
      ]
    },
    {
      "title": "Baldur's Gate 3",
      "normalized_title": "baldur s gate 3",
      "steam_appid": 1086940,
      "itad_id": "018d9584-24d6-7010-b82b-df1f0b154cc7",
      "itad_slug": "baldurs-gate-3",
      "playtime_minutes": 14083,
      "added_at": "2026-07-14T23:46:48Z",
      "sources": [
        "steam",
        "itad_collection"
      ]
    },
    {
      "title": "Batman: The Enemy Within - The Telltale Series",
      "normalized_title": "batman the enemy within the telltale series",
      "steam_appid": 675260,
      "itad_id": "018d937f-0818-728e-90f0-727cc70b0472",
      "itad_slug": "batman-the-enemy-within-the-telltale-series",
      "playtime_minutes": 582,
      "added_at": "2026-07-14T23:46:48Z",
      "sources": [
        "steam",
        "itad_collection"
      ]
    },
    {
      "title": "Batman - The Telltale Series",
      "normalized_title": "batman the telltale series",
      "steam_appid": 498240,
      "itad_id": "018d937f-1993-732b-8d28-dd8fbd7739bf",
      "itad_slug": "batman-the-telltale-series",
      "playtime_minutes": 529,
      "added_at": "2026-07-14T23:46:48Z",
      "sources": [
        "steam",
        "itad_collection"
      ]
    },
    {
      "title": "Beyond: Two Souls",
      "normalized_title": "beyond two souls",
      "steam_appid": 960990,
      "itad_id": "018d937e-f04c-70ce-b011-e610ea57d321",
      "itad_slug": "beyond-two-souls",
      "playtime_minutes": 0,
      "added_at": "2026-08-17T09:41:04Z",
      "sources": [
        "steam",
        "itad_collection"
      ]
    },
    {
      "title": "BioShock Infinite",
      "normalized_title": "bioshock infinite",
      "steam_appid": 8870,
      "itad_id": "018d937e-f877-71b3-aba5-8ff11818cd0b",
      "itad_slug": "bioshock-infinite",
      "playtime_minutes": 3,
      "added_at": "2026-07-14T23:46:48Z",
      "sources": [
        "steam",
        "itad_collection"
      ]
    },
    {
      "title": "Black Mesa",
      "normalized_title": "black mesa",
      "steam_appid": 362890,
      "itad_id": "018d937f-20eb-70ae-bb67-f6d04b00780d",
      "itad_slug": "black-mesa",
      "playtime_minutes": 0,
      "added_at": "2026-07-14T23:46:48Z",
      "sources": [
        "steam",
        "itad_collection"
      ]
    },
    {
      "title": "Braid",
      "normalized_title": "braid",
      "steam_appid": 26800,
      "itad_id": "018d937f-0651-7276-9c5d-9628dcc6b352",
      "itad_slug": "braid",
      "playtime_minutes": 0,
      "added_at": "2026-07-14T23:46:48Z",
      "sources": [
        "steam",
        "itad_collection"
      ]
    },
    {
      "title": "Braid, Anniversary Edition",
      "normalized_title": "braid anniversary edition",
      "steam_appid": 499180,
      "itad_id": "018f0689-4790-71fb-932a-950c05b00c6c",
      "itad_slug": "braid-anniversary-edition",
      "playtime_minutes": 0,
      "added_at": "2026-07-14T23:46:48Z",
      "sources": [
        "steam",
        "itad_collection"
      ]
    },
    {
      "title": "Cities: Skylines",
      "normalized_title": "cities skylines",
      "steam_appid": 255710,
      "itad_id": "018d937e-ff65-73f8-8d14-410ce85fa304",
      "itad_slug": "cities-skylines",
      "playtime_minutes": 208,
      "added_at": "2026-07-14T23:46:48Z",
      "sources": [
        "steam",
        "itad_collection"
      ]
    },
    {
      "title": "Cities: Skylines II",
      "normalized_title": "cities skylines ii",
      "steam_appid": 949230,
      "itad_id": "018d937f-6b8e-701a-8b52-fc6645051dd6",
      "itad_slug": "cities-skylines-ii",
      "playtime_minutes": 0,
      "added_at": "2026-07-14T23:46:48Z",
      "sources": [
        "steam",
        "itad_collection"
      ]
    },
    {
      "title": "Clair Obscur: Expedition 33",
      "normalized_title": "clair obscur expedition 33",
      "steam_appid": 1903340,
      "itad_id": "018ffe0d-15a7-7247-bb3c-4e5e1980561f",
      "itad_slug": "clair-obscur-expedition-33",
      "playtime_minutes": 0,
      "added_at": "2026-07-14T23:46:48Z",
      "sources": [
        "steam",
        "itad_collection"
      ]
    },
    {
      "title": "Control Ultimate Edition",
      "normalized_title": "control ultimate edition",
      "steam_appid": 870780,
      "itad_id": "018d937f-4614-7311-8f5e-54720a2e73c2",
      "itad_slug": "control-ultimate-edition",
      "playtime_minutes": 0,
      "added_at": "2026-07-14T23:46:48Z",
      "sources": [
        "steam",
        "itad_collection"
      ]
    },
    {
      "title": "Counter-Strike: Source",
      "normalized_title": "counter strike source",
      "steam_appid": 240,
      "itad_id": "018d937f-1d0a-704b-ae79-598acc6c23c5",
      "itad_slug": "counter-strike-source",
      "playtime_minutes": 0,
      "added_at": "2026-07-14T23:46:48Z",
      "sources": [
        "steam",
        "itad_collection"
      ]
    },
    {
      "title": "Cyberpunk 2077",
      "normalized_title": "cyberpunk 2077",
      "steam_appid": 1091500,
      "itad_id": "018d937f-2997-7131-b8b9-7c8af4825fa8",
      "itad_slug": "cyberpunk-2077",
      "playtime_minutes": 10779,
      "added_at": "2026-07-14T23:46:48Z",
      "sources": [
        "steam",
        "itad_collection"
      ]
    },
    {
      "title": "Daylight",
      "normalized_title": "daylight",
      "steam_appid": 230840,
      "itad_id": "018d937f-07c2-7077-bebc-928c099df1a0",
      "itad_slug": "daylight",
      "playtime_minutes": 0,
      "added_at": "2026-07-14T23:46:48Z",
      "sources": [
        "steam",
        "itad_collection"
      ]
    },
    {
      "title": "Dead Cells",
      "normalized_title": "dead cells",
      "steam_appid": 588650,
      "itad_id": "018d937f-2b4b-72f9-ab75-bc33784a295d",
      "itad_slug": "dead-cells",
      "playtime_minutes": 0,
      "added_at": "2026-07-14T23:46:48Z",
      "sources": [
        "steam",
        "itad_collection"
      ]
    },
    {
      "title": "Detroit: Become Human",
      "normalized_title": "detroit become human",
      "steam_appid": 1222140,
      "itad_id": "018d937e-f0ad-7094-b86c-d8fb32a1e6b4",
      "itad_slug": "detroit-become-human",
      "playtime_minutes": 373,
      "added_at": "2026-07-14T23:46:48Z",
      "sources": [
        "steam",
        "itad_collection"
      ]
    },
    {
      "title": "Deus Ex: Mankind Divided™",
      "normalized_title": "deus ex mankind divided",
      "steam_appid": 337000,
      "itad_id": "018d937f-07c2-7077-bebc-928c09f137d8",
      "itad_slug": "deus-ex-mankind-divided",
      "playtime_minutes": 0,
      "added_at": "2026-07-14T23:46:48Z",
      "sources": [
        "steam",
        "itad_collection"
      ]
    },
    {
      "title": "Disco Elysium",
      "normalized_title": "disco elysium",
      "steam_appid": 632470,